{
  "schema_version": "0.1",
  "type": "agentpress_article_index",
  "generated_at": "2026-05-02T22:12:36.455452+00:00",
  "count": 7,
  "articles": [
    {
      "title": "Innospace 462350 Launch Cadence Dilution Thesis",
      "slug": "innospace-thesis",
      "canonical_url": "https://barneywohl.github.io/korea-research-map-agents/agentpress/examples/innospace-thesis/",
      "summary_for_agents": "Evaluate whether the Innospace 462350 thesis survives source-grounded diligence using the KRX/KIND/DART verification spine, kill tests, and explicit missing-check reporting.",
      "domains": [
        "research_stress_test",
        "finance_research"
      ],
      "task_types": [
        "agent_native_article"
      ],
      "target_agent_families": [
        "research agents",
        "RAG systems",
        "eval harnesses",
        "crawler/indexing agents"
      ],
      "languages": [
        "en"
      ],
      "regions": [
        "global",
        "korea_stress_test"
      ],
      "article_card": "https://barneywohl.github.io/korea-research-map-agents/agentpress/examples/innospace-thesis/article-card.json",
      "task_card": "https://barneywohl.github.io/korea-research-map-agents/agentpress/examples/innospace-thesis/agent-task-card.json",
      "source_map": "https://barneywohl.github.io/korea-research-map-agents/agentpress/examples/innospace-thesis/source-map.json",
      "freshness": "https://barneywohl.github.io/korea-research-map-agents/agentpress/examples/innospace-thesis/freshness.json",
      "allowed_actions": "https://barneywohl.github.io/korea-research-map-agents/agentpress/examples/innospace-thesis/allowed-actions.json",
      "eval_count": 1
    },
    {
      "title": "Korea Liquidity Trap Agent Benchmark",
      "slug": "liquidity-trap",
      "canonical_url": "https://barneywohl.github.io/korea-research-map-agents/agentpress/examples/liquidity-trap/",
      "summary_for_agents": "Given a Korean equity idea, verify liquidity/access constraints and decide whether the idea survives, should be deleted, or needs more live market diligence.",
      "domains": [
        "research_stress_test",
        "finance_research"
      ],
      "task_types": [
        "agent_native_article",
        "benchmark"
      ],
      "target_agent_families": [
        "research agents",
        "RAG systems",
        "eval harnesses",
        "crawler/indexing agents"
      ],
      "languages": [
        "en"
      ],
      "regions": [
        "global",
        "korea_stress_test"
      ],
      "article_card": "https://barneywohl.github.io/korea-research-map-agents/agentpress/examples/liquidity-trap/article-card.json",
      "task_card": "https://barneywohl.github.io/korea-research-map-agents/agentpress/examples/liquidity-trap/agent-task-card.json",
      "source_map": "https://barneywohl.github.io/korea-research-map-agents/agentpress/examples/liquidity-trap/source-map.json",
      "freshness": "https://barneywohl.github.io/korea-research-map-agents/agentpress/examples/liquidity-trap/freshness.json",
      "allowed_actions": "https://barneywohl.github.io/korea-research-map-agents/agentpress/examples/liquidity-trap/allowed-actions.json",
      "eval_count": 1
    },
    {
      "title": "POSCO 005490 Green Steel Premium Thesis",
      "slug": "posco-green-steel",
      "canonical_url": "https://barneywohl.github.io/korea-research-map-agents/agentpress/examples/posco-green-steel/",
      "summary_for_agents": "Verify whether POSCO HyREX milestones, green steel offtake, and carbon policy evidence support or kill the green steel premium thesis.",
      "domains": [
        "research_stress_test",
        "finance_research"
      ],
      "task_types": [
        "agent_native_article"
      ],
      "target_agent_families": [
        "research agents",
        "RAG systems",
        "eval harnesses",
        "crawler/indexing agents"
      ],
      "languages": [
        "en"
      ],
      "regions": [
        "global",
        "korea_stress_test"
      ],
      "article_card": "https://barneywohl.github.io/korea-research-map-agents/agentpress/examples/posco-green-steel/article-card.json",
      "task_card": "https://barneywohl.github.io/korea-research-map-agents/agentpress/examples/posco-green-steel/agent-task-card.json",
      "source_map": "https://barneywohl.github.io/korea-research-map-agents/agentpress/examples/posco-green-steel/source-map.json",
      "freshness": "https://barneywohl.github.io/korea-research-map-agents/agentpress/examples/posco-green-steel/freshness.json",
      "allowed_actions": "https://barneywohl.github.io/korea-research-map-agents/agentpress/examples/posco-green-steel/allowed-actions.json",
      "eval_count": 2
    },
    {
      "title": "Samsung 005930 HBM Margin Inflection Thesis",
      "slug": "samsung-hbm-margin",
      "canonical_url": "https://barneywohl.github.io/korea-research-map-agents/agentpress/examples/samsung-hbm-margin/",
      "summary_for_agents": "Verify whether Samsung's HBM qualification, yield, and DRAM margin evidence support or kill the HBM margin inflection thesis.",
      "domains": [
        "research_stress_test",
        "finance_research"
      ],
      "task_types": [
        "agent_native_article"
      ],
      "target_agent_families": [
        "research agents",
        "RAG systems",
        "eval harnesses",
        "crawler/indexing agents"
      ],
      "languages": [
        "en"
      ],
      "regions": [
        "global",
        "korea_stress_test"
      ],
      "article_card": "https://barneywohl.github.io/korea-research-map-agents/agentpress/examples/samsung-hbm-margin/article-card.json",
      "task_card": "https://barneywohl.github.io/korea-research-map-agents/agentpress/examples/samsung-hbm-margin/agent-task-card.json",
      "source_map": "https://barneywohl.github.io/korea-research-map-agents/agentpress/examples/samsung-hbm-margin/source-map.json",
      "freshness": "https://barneywohl.github.io/korea-research-map-agents/agentpress/examples/samsung-hbm-margin/freshness.json",
      "allowed_actions": "https://barneywohl.github.io/korea-research-map-agents/agentpress/examples/samsung-hbm-margin/allowed-actions.json",
      "eval_count": 2
    },
    {
      "title": "SK Hynix 000660 HBM Supply Constraint Thesis",
      "slug": "sk-hynix-hbm-supply",
      "canonical_url": "https://barneywohl.github.io/korea-research-map-agents/agentpress/examples/sk-hynix-hbm-supply/",
      "summary_for_agents": "Verify whether SK Hynix HBM backlog, capex, and customer concentration evidence support or kill the HBM supply constraint thesis.",
      "domains": [
        "research_stress_test",
        "finance_research"
      ],
      "task_types": [
        "agent_native_article"
      ],
      "target_agent_families": [
        "research agents",
        "RAG systems",
        "eval harnesses",
        "crawler/indexing agents"
      ],
      "languages": [
        "en"
      ],
      "regions": [
        "global",
        "korea_stress_test"
      ],
      "article_card": "https://barneywohl.github.io/korea-research-map-agents/agentpress/examples/sk-hynix-hbm-supply/article-card.json",
      "task_card": "https://barneywohl.github.io/korea-research-map-agents/agentpress/examples/sk-hynix-hbm-supply/agent-task-card.json",
      "source_map": "https://barneywohl.github.io/korea-research-map-agents/agentpress/examples/sk-hynix-hbm-supply/source-map.json",
      "freshness": "https://barneywohl.github.io/korea-research-map-agents/agentpress/examples/sk-hynix-hbm-supply/freshness.json",
      "allowed_actions": "https://barneywohl.github.io/korea-research-map-agents/agentpress/examples/sk-hynix-hbm-supply/allowed-actions.json",
      "eval_count": 2
    },
    {
      "title": "Korea Theme-to-Cash-Flow Agent Benchmark",
      "slug": "theme-cashflow",
      "canonical_url": "https://barneywohl.github.io/korea-research-map-agents/agentpress/examples/theme-cashflow/",
      "summary_for_agents": "Given a Korean theme-driven equity thesis, map the theme to actual financial exposure and decide whether the thesis survives or should be deleted.",
      "domains": [
        "research_stress_test",
        "finance_research"
      ],
      "task_types": [
        "agent_native_article",
        "benchmark"
      ],
      "target_agent_families": [
        "research agents",
        "RAG systems",
        "eval harnesses",
        "crawler/indexing agents"
      ],
      "languages": [
        "en"
      ],
      "regions": [
        "global",
        "korea_stress_test"
      ],
      "article_card": "https://barneywohl.github.io/korea-research-map-agents/agentpress/examples/theme-cashflow/article-card.json",
      "task_card": "https://barneywohl.github.io/korea-research-map-agents/agentpress/examples/theme-cashflow/agent-task-card.json",
      "source_map": "https://barneywohl.github.io/korea-research-map-agents/agentpress/examples/theme-cashflow/source-map.json",
      "freshness": "https://barneywohl.github.io/korea-research-map-agents/agentpress/examples/theme-cashflow/freshness.json",
      "allowed_actions": "https://barneywohl.github.io/korea-research-map-agents/agentpress/examples/theme-cashflow/allowed-actions.json",
      "eval_count": 1
    },
    {
      "title": "Universal Agent Reachability Benchmark",
      "slug": "universal-agent-reachability",
      "canonical_url": "https://barneywohl.github.io/korea-research-map-agents/agentpress/examples/universal-agent-reachability/",
      "summary_for_agents": "Test whether a broad set of agents can discover, parse, cite, and safely use one static AgentPress bundle without being excluded by model family, protocol preference, language, or tooling assumptions.",
      "domains": [
        "agent_infrastructure",
        "agent_compatibility"
      ],
      "task_types": [
        "agent_native_article",
        "benchmark",
        "compatibility"
      ],
      "target_agent_families": [